<?xml version="1.0"?>
<!--
To change this license header, choose License Headers in Project Properties.
To change this template file, choose Tools | Templates
and open the template in the editor.
-->

<xs:schema version="1.0"
           xmlns:xs="http://www.w3.org/2001/XMLSchema"
           elementFormDefault="qualified"
           targetNamespace="https://rsatu.ru/continents"
           xmlns="https://rsatu.ru/continents">
    
    <xs:element name="planet" type="planetType"/>
    
    <xs:complexType name="planetType">
        <xs:sequence>
            <xs:element name="name" type="xs:string"/>
                <xs:element name="area" type="xs:decimal" />
                <xs:element name="continent" type="continentType" maxOccurs="7" minOccurs="7"/>
        </xs:sequence>
    </xs:complexType>
    
    <xs:complexType name="continentType">
        <xs:sequence>
            <xs:element name="name" type="xs:string"/>
            <xs:element name="area" type="xs:decimal" />
            <xs:element name="country" type="countryType" minOccurs="0" maxOccurs="999"/>
        </xs:sequence>
    </xs:complexType>
    
    <xs:complexType name="countryType">
        <xs:sequence>
            <xs:element name="name" type="xs:string"/>
            <xs:element name="area" type="xs:decimal" />
        </xs:sequence>
    </xs:complexType>

</xs:schema>